{
  "postType": "rom",
  "name": "DerpFest 14",
  "tag": "DerpFest",
  "stability": "STABLE",
  "releaseType": "UNOFFICIAL",
  "device": "RM6785",
  "androidVersion": "14",
  "ruiVersion": 2,
  "author": "@nx_neon69",
  "buildDate": "2024-04-03",
  "banner": "telegram-message:-1001384382397:2277",
  "changelog": [
    "Initial release"
  ],
  "bugs": [
    "Native video calling (ViLTE)",
    "Voice over WiFi (VoWiFi)"
  ],
  "notes": [
    "Based on April ASB (QPR2)",
    "Shipped with Lineage Kernel"
  ],
  "download": {
    "buildType": "GMS",
    "fileSize": "2.1 GB",
    "url": "https://drive.google.com/file/d/1kwrdOL78a-6FcxS6moUnKivgLCZvi2fK/view?usp=sharing"
  },
  "links": {
    "sources": "https://github.com/realme-mt6785-devs",
    "screenshots": "https://t.me/sourlemonrm6785/51577?single",
    "supportGroup": "https://t.me/sourlemonrm6785"
  }
}
