{
  "postType": "rom",
  "name": "CrDroid 10.5",
  "tag": "CrDroid",
  "stability": "STABLE",
  "releaseType": "UNOFFICIAL",
  "device": "RM6785",
  "androidVersion": "14",
  "ruiVersion": 2,
  "author": "@nx_neon69",
  "buildDate": "2024-05-20",
  "banner": "telegram-message:-1001384382397:2299",
  "changelog": [
    "Fixed QS Alignment",
    "May ASB",
    "[Changelog](https://crdroid.net/blog/2024-05-12-crDroid-10.5-released)"
  ],
  "bugs": [
    "Native video calling (ViLTE)",
    "Voice over WiFi (VoWiFi)"
  ],
  "notes": [
    "Based on May ASB (QPR2)",
    "Shipped with Lineage Kernel",
    "Recommended [GAPPS](https://t.me/sourlemonrm6785/50646)"
  ],
  "download": {
    "buildType": "Vanilla",
    "fileSize": "1.4 GB",
    "url": "https://drive.google.com/file/d/1-DKwLE5k9S1bOlIbvae6nQM5XXNf2KjD/view?usp=sharing"
  },
  "links": {
    "sources": "https://github.com/realme-mt6785-devs",
    "screenshots": "https://t.me/sourlemonrm6785/63194",
    "supportGroup": "https://t.me/sourlemonrm6785"
  }
}
