{
  "postType": "rom",
  "name": "Matrixx 11.2.0",
  "tag": "ProjectMatrixx",
  "stability": "STABLE",
  "releaseType": "OFFICIAL",
  "device": "salaa",
  "androidVersion": "15",
  "ruiVersion": 3,
  "author": "@EvilAnsh",
  "buildDate": "2025-02-13",
  "banner": "telegram-message:-1001384382397:2370",
  "changelog": [
    "Feb, 2025 Security Patch",
    "Full changelog: [MATRIXX](https://www.projectmatrixx.org/changelog)"
  ],
  "bugs": [
    "Native video calling (ViLTE) and Voice over WiFi (VoWiFi)"
  ],
  "notes": [
    "4.14.336 Stormbreaker Kernel",
    "Clean Flash recommended"
  ],
  "download": {
    "buildType": "VANILLA/GAPPS",
    "fileSize": "1.4GB | 2.4GB",
    "url": "https://www.projectmatrixx.org/downloads/salaa"
  },
  "links": {
    "sources": "https://github.com/Matrixx-Devices/device_realme_salaa",
    "screenshots": "https://t.me/AnshPrjkt/960?single",
    "supportGroup": "https://t.me/Anshbuilds"
  }
}
