{
  "postType": "kernel",
  "name": "N.E.O.L.I.T.-V5 Yoko Kernel",
  "tag": "NEOLIT",
  "stability": "STABLE",
  "device": "RMX2001",
  "kernelVersion": "05.11.2021",
  "ruiVersion": 2,
  "author": "Sarthak Roy",
  "buildDate": "2021-11-05",
  "banner": "telegram-message:-1001384382397:1452",
  "changelog": [
    "Based on Realme Android R kernel drop",
    "Based over ACK 4.14-stable",
    "Compiled using Clang 11",
    "Add NEON accelerated XOR implementation",
    "Refactor & trim kernel version logic",
    "Use pipes rather than temporary files for intermediate steps",
    "Add TTL Module support",
    "Disable EAS_PREFER_IDLE",
    "Don't allow userspace to impose restrictions on CPU idle levels",
    "Kill userspace CPU boosting entirely",
    "Avoid userspace from changing maxfreq",
    "Force applications to use TCP_NODELAY to improve network latency",
    "Disable debug mask",
    "Disable many MTK crap Debugging",
    "Add nintendo driver",
    "Silence TEE logs from userspace",
    "Enable zram-writeback",
    "Many more lol"
  ],
  "bugs": [
    "Not listed in original post"
  ],
  "notes": [
    "\"wasabi\" is a unified kernel name for R6/7/N20P/N30",
    "ONLY FOR REALME UI 2 BASED ROMs"
  ],
  "download": {
    "url": "https://sourceforge.net/projects/sarthak-android-projects/files/kernels/wasabi/NEOLIT-V5-Yoko-KERNEL-wasabi-05112021.zip/download"
  },
  "links": {}
}
