{
  "postType": "rom",
  "name": "Matrixx 11.1.0",
  "tag": "Matrixx",
  "stability": "STABLE",
  "releaseType": "UNOFFICIAL",
  "device": "RMX2001",
  "androidVersion": "15",
  "ruiVersion": 2,
  "author": "@EvilAnsh",
  "buildDate": "2025-02-06",
  "banner": "telegram-message:-1001384382397:2361",
  "changelog": [
    "Initial Build",
    "Jan, 2025 Security Patch",
    "Full changelog: [MATRIXX](https://www.projectmatrixx.org/changelog)"
  ],
  "bugs": [
    "Native video calling (ViLTE) and Voice over WiFi (VoWiFi)"
  ],
  "notes": [
    "4.14.348 Samar's Kernel",
    "Clean Flash recommended"
  ],
  "download": {
    "buildType": "VANILLA/GAPPS",
    "fileSize": "1.4GB | 2.4GB",
    "url": "https://t.me/FilesArchieve/254?single"
  },
  "links": {
    "sources": "https://github.com/EvilAnsh/android_device_realme_RM6785-common",
    "screenshots": "https://t.me/AnshPrjkt/932?single",
    "supportGroup": "https://t.me/Anshbuilds"
  }
}
