{
  "postType": "rom",
  "name": "Nusantara Project v4.1",
  "tag": "NusantaraProject",
  "stability": "STABLE",
  "releaseType": "OFFICIAL",
  "device": "RM6785",
  "androidVersion": "12",
  "ruiVersion": 2,
  "author": "@officialputuid",
  "buildDate": "2022-01-17",
  "banner": "telegram-message:-1001384382397:1582",
  "changelog": [
    "January 2022 ASB",
    "Fixed battery usage",
    "Remove all prebuilts apk",
    "Inlined latest Pixelated launcher",
    "Misc & performance improvements",
    "Added f2fs support for userdata partition",
    "Rebrand realmeParts to Additional Settings",
    "(A.S) Cleanup & update icon",
    "(A.S) Drop Double-tap to wake",
    "(A.S) Drop Screen refresh rate"
  ],
  "bugs": [
    "Built-in screen recorder",
    "Permissive SELinux"
  ],
  "notes": [
    "Vanilla & GApps Build",
    "For Vanilla Build, Use BitGApps (Only)"
  ],
  "download": {
    "buildType": "VANILLA/GAPPS",
    "fileSize": "945MB | 1.4GB",
    "url": "https://www.pling.com/p/1500429/"
  },
  "links": {
    "sources": "https://github.com/psionicprjkt/",
    "screenshots": "https://t.me/psionicprjkt/307",
    "supportGroup": "https://t.me/psionicprjktchat"
  }
}
